{
  "gitsha": "sample",
  "preset": "4090",
  "width": 1920,
  "height": 1080,
  "fibers": 4096,
  "fiber_samples": 64,
  "particles": 262144,
  "orbs": 1024,
  "frames": 600,
  "glow": true,
  "dirty_particles": true,
  "dirty_fibers": true,
  "multiply": "left",
  "tube_radius": 0.012,
  "ms_wall": 0.0,
  "ms_mean": 0.0,
  "ms_min": 0.0,
  "ms_max": 0.0,
  "hz": 0.0,
  "write_buffer_calls": 0,
  "ring_copies": 0,
  "static_uploads": 1,
  "static_skipped": 0,
  "live_skipped": 0,
  "particle_skipped": 0,
  "particle_grows": 1,
  "particle_fallbacks": 0,
  "fiber_reallocs": 1,
  "vram_estimate_bytes": 0,
  "capture_bytes": 0,
  "claims": "Software fact",
  "not_a_proof_of": "inner_cone mosaic / qga-app cosmos"
}
